id,diagnostic_type,domain,domain_cn,scenario_stage,tool_type,difficulty,question,A,B,C,D,answer,answer_rationale,failure_mode,benchmark_version,tags
SGS-HARD-044,multi_objective_tradeoff,general_chemistry,普通化学,多目标取舍,tradeoff_matrix,advanced,干燥储存保持空白稳定但响应启动慢，常湿储存响应快但空白上移。若强调长期一致性，应选？,常湿储存并缩短读数窗口并复核,常湿储存并增加出厂校准,混合储存条件平衡响应和空白,干燥储存并重新设定启动读数窗口,D,长期一致性优先空白稳定，应选干燥储存并调整启动读数。,metric_overoptimization,mini-benchmark-0.5.0,"[""storage"", ""blank"", ""readout""]"
SGS-HARD-045,mechanism_transfer_trap,physical_chemistry,物理化学,机理迁移陷阱,mechanism_map,advanced,模型把 n 型 MOS 中还原气导致电阻下降的判断，迁移到 p 型氧化物样品。当前最稳妥做法是？,先确认载流子类型再讨论响应方向,沿用 n 型响应方向并比较峰值大小,把电阻下降视为还原气通用特征,用同一机理图解释两类样品并留痕,A,响应方向依赖载流子类型，不能把 n 型机理套用到 p 型材料。,mechanism_transfer_error,mini-benchmark-0.5.0,"[""p_type"", ""n_type"", ""MOS""]"
SGS-HARD-046,mechanism_transfer_trap,organic_chemistry,有机化学,机理迁移陷阱,mechanism_map,advanced,模型用 MOS 表面耗尽层机理解释纸带颜色变化。若题目是显色纸带，应如何修正？,保留耗尽层机理并补充颜色读数加对照,改用显色反应和空白自显色边界,把颜色变化解释为电荷耗尽深度,用工作温度变化验证耗尽层假设,B,纸带颜色变化应从显色反应和空白自显色边界解释，不套用 MOS 耗尽层。,mechanism_transfer_error,mini-benchmark-0.5.0,"[""paper_tape"", ""MOS"", ""chromogenic""]"
SGS-HARD-047,mechanism_transfer_trap,materials_science,材料科学,机理迁移陷阱,mechanism_map,advanced,PANI 对 NH3 响应被模型解释为金属氧化物表面吸附氧释放电子。更合适的机理边界是？,沿用吸附氧电子释放并比较温度效应,把响应统一归因于表面氧空位变化,回到质子化状态与聚合物导电变化,用金属氧化物缺陷模型解释湿度漂移,C,导电聚合物响应应回到质子化状态和导电变化，不套用金属氧化物吸附氧模型。,mechanism_transfer_error,mini-benchmark-0.5.0,"[""PANI"", ""NH3"", ""polymer""]"
SGS-HARD-048,mechanism_transfer_trap,inorganic_chemistry,无机化学,机理迁移陷阱,mechanism_map,advanced,贵金属修饰提升某氧化物响应，模型把同样结论迁移到另一材料且未检查工作温度和气体种类。应如何判断？,按贵金属通用敏化效应推进路线,优先比较贵金属负载后的峰值响应,把迁移结论写成跨材料通用规则,限定为候选假设并重做条件匹配,D,贵金属效应依赖材料、温度和气体，应作为候选假设并重做条件匹配。,mechanism_transfer_error,mini-benchmark-0.5.0,"[""noble_metal"", ""sensitization"", ""transfer""]"
SGS-HARD-049,mechanism_transfer_trap,analytical_chemistry,分析化学,机理迁移陷阱,mechanism_map,advanced,光学读数平台出现颜色饱和，模型建议调整电阻基线校正方法。更合适修正是？,回到光学动态范围和颜色饱和校正,沿用电阻基线校正并增加空白样本,把颜色饱和解释为电阻漂移现象并留痕,提高工作温度观察基线是否稳定,A,光学读数应处理动态范围和颜色饱和，不能套用电阻基线校正。,mechanism_transfer_error,mini-benchmark-0.5.0,"[""optical"", ""resistive"", ""dynamic_range""]"
SGS-HARD-050,mechanism_transfer_trap,general_chemistry,普通化学,机理迁移陷阱,mechanism_map,advanced,模型把湿度造成的纸带空白变色，解释成 MOS 表面羟基改变载流子浓度。最稳妥处理是？,保留羟基载流子解释并补湿度阶跃,改为纸带基体吸水和试剂自反应边界,用载流子模型推导颜色变化方向加对照,提高纸带工作温度复核湿度影响,B,纸带湿度问题应从基体吸水和试剂自反应解释，不迁移 MOS 载流子模型。,mechanism_transfer_error,mini-benchmark-0.5.0,"[""humidity"", ""paper_tape"", ""mechanism""]"
